{
  "actions": {
    "flee": {
      "traitDelta": {
        "Survival": 0.01
      }
    },
    "rest": {
      "traitDelta": {
        "Levity": 0.02,
        "Equilibrium": 0.04
      },
      "energyDeltaBase": 0.2,
      "energyDeltaRestRoom": 0.3
    },
    "talk": {
      "traitDelta": {
        "Empathy": 0.05,
        "Comprehension": 0.03
      },
      "featureDelta": {
        "Awareness": 0.05
      },
      "noTargetTraitDelta": {
        "Empathy": -0.01
      }
    },
    "fight": {
      "xpDelta": 4,
      "traitDelta": {
        "Survival": 0.03,
        "Direction": 0.03
      },
      "featureDelta": {
        "Momentum": 0.1
      }
    },
    "steal": {
      "traitDelta": {
        "Survival": 0.02,
        "Constraint": 0.01
      },
      "featureDelta": {
        "Guile": 0.15
      }
    },
    "train": {
      "xpDelta": 5,
      "traitDelta": {
        "Direction": 0.05,
        "Constraint": 0.07
      },
      "energyDelta": -0.15,
      "featureDelta": {
        "Momentum": 0.1
      }
    },
    "murder": {
      "xpDelta": 10,
      "traitDelta": {
        "Survival": 0.06,
        "Constraint": -0.04
      },
      "featureDelta": {
        "Momentum": 0.2
      },
      "reputationDelta": -2
    },
    "reEquip": {
      "featureDelta": {
        "Momentum": 0.04
      }
    },
    "recruit": {
      "traitDelta": {
        "Empathy": 0.04
      },
      "featureDelta": {
        "Awareness": 0.1
      }
    },
    "useItem": {
      "traitDelta": {
        "Comprehension": 0.02
      },
      "featureDelta": {
        "Awareness": 0.02
      }
    },
    "dropItem": {
      "featureDelta": {
        "Momentum": -0.02
      }
    },
    "purchase": {
      "traitDelta": {
        "Constraint": 0.02,
        "Comprehension": 0.02
      },
      "featureDelta": {
        "Momentum": 0.03,
        "Awareness": 0.05
      }
    },
    "equipItem": {
      "featureDelta": {
        "Momentum": 0.03
      }
    },
    "liveStream": {
      "effortCost": 10,
      "traitDelta": {
        "Projection": 0.03
      },
      "featureDelta": {
        "Momentum": 0.2
      }
    },
    "searchEmpty": {
      "traitDelta": {
        "Comprehension": 0.01
      }
    }
  },
  "deedProjection": {
    "globalBudget": 0.35,
    "perFeatureCap": 0.22
  },
  "entityPressure": {
    "cap": 120,
    "countItemsAsEntities": true
  },
  "canonicalSeedV1": 20260227,
  "roomInfluenceScale": 0.05
}
